Name,Preferred Subject,Target College,Preparation Level,Learning Style,Recommended Mentors,Feedback Score
Piyush Mittal,Legal Reasoning,NLU Delhi,Advanced,Visual,"Ankit Sharma, Sunita Singh, Rajat Jain",2
Anmol ,Logical Reasoning,NLU Patna,Beginner,Auditory,"Mohan Gupta, Sunita Singh, Rajat Jain",1
meenakshi,Legal Reasoning,NLU Delhi,Intermediate,Visual,"Sunita Singh, Ankit Sharma, Anil Mehra",5
jatin,Quantitative Techniques,NLU Delhi,Beginner,Visual,"Rajat Jain, Mohan Gupta, Anil Mehra",2
-